Имя,UserID,Верно,Всего,Ответы
GJJH HKJK,623765402,17,44,А В А В А В А В А В А В А В А В А В А В А В А В А В А В А В А В А В А В А В А В А В А В
Солихов Эхром,623765402,69,183,А А В В В В В В В С А В В С А А В А В В А В В В А В А В В В А А В А В А В А А В А В В С А В В С С А С А С А С А С А В С А В В А В А С А С В А С А В С А В В А В С А С А В С А С В А С В А С А С В А С А В В В А В С В А В С А В А В С А В С А В С А В В В В А А В А В С А В А В С С А С А С А В А В А В А В А В В А В С А В А С А С А С А В С А С А С А С А В С А С А В А С А
Наталья Николаевна,2096268125,42,183,В А В В В С А В А В В А С В А В В В С А А В С А С А В А С В В В В А С А В А А В С А С А В С А В С А В А С А В А В А С А С А В С А С А В С А С А С В А С А В В А А В А А А В В С А В С А В С А С А С В А В С А В С А В А В А С А С В А С В А В В А А С А В А В А В В А В С А С В А А В А В А А А А А А А А В В А В В А В В А А В С А В А В В А А В В А А А А А А С А А В С А С
Наталья Николаевна,623765402,59,183,А В А В А В А В А В А В А В А В А В А В А В А В А В А В А В А В А В А В А В А В А В А В А В А В А В А В А В А В А В А В А В А В А В А В А В А В А В А В А А В А В А В А В А В А В А В А В А В А В В В А В А В А В А В А В А В А В А В А В А В В А А В В А В А В А В А В А В А В А В А В А В А В А В А В А В А В А В А В А В А В А В А В А В А В А В А В А В А В А В А В А В А
Ehrom S,623765402,85,183,А В В А В В А С В А С В А С А В С А С В В В В В В В В В В В В В В В В В В В В В В В В В В В В В В А В В В В В А В В С В А В В В В В В В В В В В В В В В А В А В В В В В В В В В С В В В В В В В В В В В В В В В В В В В В В В В В В В В В В А С В В В В А В В В С А А В В А В С А В С А С В А В В С В А В В С В А В С В А В С В С В В В В В А В В А В В С В С В А В С В В А В
Хурсан Владимир,207738726,29,183,А А А А А А А А А А А А А А А А А А А А А А А А А А А А А А А А А А А А А А А А А А А А А А А А А А А А А А А А А А А А А А А А А А А А А А А А А А А А А А А А А А А А А А А А А А А А А А А А А А А А А А А А А А А А А А А А А А А А А А А А А А А А А А А А А А А А А А А А В А А А А А А А А А А А А А А А А А А А А А А А А А А А А А А А А А А А А А А А А А А А А А А
